{
  "schema_version": "1.0",
  "plan_id": "SER-PARALLEL-PLAN-2026-09-23",
  "baseline_sha": "d2988e97e7b6c5fe1fd561852e947a155c2d731b",
  "catalog_kind": "PLANNING_OBLIGATIONS_NOT_EXECUTED_TESTS",
  "launchable": false,
  "cases": [
    {
      "case_id": "T01",
      "family": "TRANSVERSAL",
      "subject": "Schema fechado",
      "scope": "ALL",
      "applicability": "always",
      "setup": "Contexto mínimo válido.",
      "stimulus_or_mutation": "Acrescentar campo desconhecido e versão não suportada.",
      "expected_observation": "Recusar antes do cálculo; não descartar silenciosamente campos.",
      "oracle_kind": "contract",
      "evidence_required": "payload, schema version, issues",
      "phase": "LOCAL_CERTIFICATION",
      "implementation_status": "PLANNED_NOT_IMPLEMENTED",
      "runtime_status": "NOT_RUN",
      "test_id_bindings": [],
      "source_basis": "Proposta aprovada P0; detalhamento de autoria desta versão, não execução observada."
    },
    {
      "case_id": "T02",
      "family": "TRANSVERSAL",
      "subject": "Campos materiais",
      "scope": "ALL",
      "applicability": "always",
      "setup": "Fixture válida por operação.",
      "stimulus_or_mutation": "Remover cada campo material isoladamente.",
      "expected_observation": "Identificar campo ausente; nenhum default material inventado.",
      "oracle_kind": "contract",
      "evidence_required": "matriz campo/resultado",
      "phase": "LOCAL_CERTIFICATION",
      "implementation_status": "PLANNED_NOT_IMPLEMENTED",
      "runtime_status": "NOT_RUN",
      "test_id_bindings": [],
      "source_basis": "Proposta aprovada P0; detalhamento de autoria desta versão, não execução observada."
    },
    {
      "case_id": "T03",
      "family": "TRANSVERSAL",
      "subject": "Coerência cruzada",
      "scope": "ALL",
      "applicability": "always",
      "setup": "Datas, população e operação vinculadas.",
      "stimulus_or_mutation": "Introduzir combinações contraditórias.",
      "expected_observation": "Bloquear o contexto; não escolher uma interpretação arbitrária.",
      "oracle_kind": "contract",
      "evidence_required": "contexto e regra aplicada",
      "phase": "LOCAL_CERTIFICATION",
      "implementation_status": "PLANNED_NOT_IMPLEMENTED",
      "runtime_status": "NOT_RUN",
      "test_id_bindings": [],
      "source_basis": "Proposta aprovada P0; detalhamento de autoria desta versão, não execução observada."
    },
    {
      "case_id": "T04",
      "family": "TRANSVERSAL",
      "subject": "Aplicabilidade",
      "scope": "ALL",
      "applicability": "always",
      "setup": "Etapa condicional com verdadeiro/falso/indeterminado.",
      "stimulus_or_mutation": "Omitir premissa necessária à decisão.",
      "expected_observation": "UNKNOWN bloqueia etapa material; falso legítimo registra NA com razão.",
      "oracle_kind": "contract",
      "evidence_required": "predicate_id e três outcomes",
      "phase": "LOCAL_CERTIFICATION",
      "implementation_status": "PLANNED_NOT_IMPLEMENTED",
      "runtime_status": "NOT_RUN",
      "test_id_bindings": [],
      "source_basis": "Proposta aprovada P0; detalhamento de autoria desta versão, não execução observada."
    },
    {
      "case_id": "T05",
      "family": "TRANSVERSAL",
      "subject": "Defaults não autorizados",
      "scope": "ALL",
      "applicability": "always",
      "setup": "Pedido sem escolha de método/destino/threshold material.",
      "stimulus_or_mutation": "Tentar completar automaticamente.",
      "expected_observation": "Nenhuma decisão material inferida de conveniência.",
      "oracle_kind": "contract",
      "evidence_required": "contexto incompleto e decisão",
      "phase": "LOCAL_CERTIFICATION",
      "implementation_status": "PLANNED_NOT_IMPLEMENTED",
      "runtime_status": "NOT_RUN",
      "test_id_bindings": [],
      "source_basis": "Proposta aprovada P0; detalhamento de autoria desta versão, não execução observada."
    },
    {
      "case_id": "T06",
      "family": "TRANSVERSAL",
      "subject": "Contenção de path",
      "scope": "ALL",
      "applicability": "when_effect_or_path_handling",
      "setup": "Destino de teste dentro de raiz aprovada.",
      "stimulus_or_mutation": "Traversal, absoluto externo e prefixo parecido.",
      "expected_observation": "Recusar escape antes de escrita.",
      "oracle_kind": "contract",
      "evidence_required": "paths resolvidos e árvore antes/depois",
      "phase": "LOCAL_CERTIFICATION",
      "implementation_status": "PLANNED_NOT_IMPLEMENTED",
      "runtime_status": "NOT_RUN",
      "test_id_bindings": [],
      "source_basis": "Proposta aprovada P0; detalhamento de autoria desta versão, não execução observada."
    },
    {
      "case_id": "T07",
      "family": "TRANSVERSAL",
      "subject": "Alias de filesystem",
      "scope": "ALL",
      "applicability": "when_effect_or_path_handling",
      "setup": "Root controlado em host pertinente.",
      "stimulus_or_mutation": "Symlink/junction/ciclo apontando fora ou para arquivo.",
      "expected_observation": "Falhar fechado sem escapar da raiz.",
      "oracle_kind": "contract",
      "evidence_required": "tipo de link, destino e resultado",
      "phase": "LOCAL_CERTIFICATION",
      "implementation_status": "PLANNED_NOT_IMPLEMENTED",
      "runtime_status": "NOT_RUN",
      "test_id_bindings": [],
      "source_basis": "Proposta aprovada P0; detalhamento de autoria desta versão, não execução observada."
    },
    {
      "case_id": "T08",
      "family": "TRANSVERSAL",
      "subject": "API pública",
      "scope": "ALL",
      "applicability": "always",
      "setup": "Fachada pública conferida e assinatura congelada.",
      "stimulus_or_mutation": "Import privado, símbolo inexistente ou assinatura errada.",
      "expected_observation": "Recusar/informar incompatibilidade, sem fallback ad hoc.",
      "oracle_kind": "contract",
      "evidence_required": "facade hash, signature inventory, erro",
      "phase": "LOCAL_CERTIFICATION",
      "implementation_status": "PLANNED_NOT_IMPLEMENTED",
      "runtime_status": "NOT_RUN",
      "test_id_bindings": [],
      "source_basis": "Proposta aprovada P0; detalhamento de autoria desta versão, não execução observada."
    },
    {
      "case_id": "T09",
      "family": "TRANSVERSAL",
      "subject": "Chamada canônica",
      "scope": "ALL",
      "applicability": "always",
      "setup": "Positivo válido com monitor de chamada.",
      "stimulus_or_mutation": "Omitir a chamada e fornecer saída parecida.",
      "expected_observation": "Não emitir prova de execução aceita.",
      "oracle_kind": "contract",
      "evidence_required": "evento de chamada e mutante rejeitado",
      "phase": "LOCAL_CERTIFICATION",
      "implementation_status": "PLANNED_NOT_IMPLEMENTED",
      "runtime_status": "NOT_RUN",
      "test_id_bindings": [],
      "source_basis": "Proposta aprovada P0; detalhamento de autoria desta versão, não execução observada."
    },
    {
      "case_id": "T10",
      "family": "TRANSVERSAL",
      "subject": "Parâmetros efetivos",
      "scope": "ALL",
      "applicability": "always",
      "setup": "Parâmetros completos e vinculados.",
      "stimulus_or_mutation": "Trocar parâmetro entre preflight, chamada e Receipt.",
      "expected_observation": "Binding mismatch; conclusão bloqueada.",
      "oracle_kind": "contract",
      "evidence_required": "effective arguments e record",
      "phase": "LOCAL_CERTIFICATION",
      "implementation_status": "PLANNED_NOT_IMPLEMENTED",
      "runtime_status": "NOT_RUN",
      "test_id_bindings": [],
      "source_basis": "Proposta aprovada P0; detalhamento de autoria desta versão, não execução observada."
    },
    {
      "case_id": "T11",
      "family": "TRANSVERSAL",
      "subject": "Identidade de input",
      "scope": "ALL",
      "applicability": "always",
      "setup": "População/linhas/ordem/schema conhecidos.",
      "stimulus_or_mutation": "Trocar dados mantendo nome textual do dataset.",
      "expected_observation": "Divergência detectada; texto não substitui identidade efetiva.",
      "oracle_kind": "contract",
      "evidence_required": "input digest e IDs da fixture",
      "phase": "LOCAL_CERTIFICATION",
      "implementation_status": "PLANNED_NOT_IMPLEMENTED",
      "runtime_status": "NOT_RUN",
      "test_id_bindings": [],
      "source_basis": "Proposta aprovada P0; detalhamento de autoria desta versão, não execução observada."
    },
    {
      "case_id": "T12",
      "family": "TRANSVERSAL",
      "subject": "Dependência ausente",
      "scope": "ALL",
      "applicability": "always",
      "setup": "Ambiente com dependency manifest.",
      "stimulus_or_mutation": "Indisponibilizar biblioteca opcional necessária.",
      "expected_observation": "BLOCKED_ENVIRONMENT; não sintetizar resultado.",
      "oracle_kind": "contract",
      "evidence_required": "import failure e dependency manifest",
      "phase": "LOCAL_CERTIFICATION",
      "implementation_status": "PLANNED_NOT_IMPLEMENTED",
      "runtime_status": "NOT_RUN",
      "test_id_bindings": [],
      "source_basis": "Proposta aprovada P0; detalhamento de autoria desta versão, não execução observada."
    },
    {
      "case_id": "T13",
      "family": "TRANSVERSAL",
      "subject": "Erro real do helper",
      "scope": "ALL",
      "applicability": "always",
      "setup": "Entrada que alcança helper.",
      "stimulus_or_mutation": "Injetar exceção controlada na função chamada.",
      "expected_observation": "Sem Receipt PASS/false completion; erro preservado.",
      "oracle_kind": "contract",
      "evidence_required": "traceback, call marker, outputs",
      "phase": "LOCAL_CERTIFICATION",
      "implementation_status": "PLANNED_NOT_IMPLEMENTED",
      "runtime_status": "NOT_RUN",
      "test_id_bindings": [],
      "source_basis": "Proposta aprovada P0; detalhamento de autoria desta versão, não execução observada."
    },
    {